{
    "$schema":  "https://json-schema.org/draft/2020-12/schema",
    "$id":  "proxtel-auditor-behavioral-response-v2.schema.json",
    "title":  "PROXTEL Skill Auditor Behavioral Response v2",
    "type":  "object",
    "additionalProperties":  false,
    "required":  [
                     "case_id",
                     "auditor_should_engage",
                     "primary_action",
                     "execute_allowed",
                     "safe_to_execute",
                     "audit_status",
                     "final_decision",
                     "evidence_required",
                     "facts",
                     "inferences",
                     "unknowns",
                     "required_actions",
                     "token_measurement",
                     "actual_tokens"
                 ],
    "properties":  {
                       "case_id":  {
                                       "type":  "string",
                                       "minLength":  1
                                   },
                       "auditor_should_engage":  {
                                                     "type":  "boolean"
                                                 },
                       "primary_action":  {
                                              "type":  "string",
                                              "enum":  [
                                                           "AUDIT",
                                                           "REQUEST-EVIDENCE",
                                                           "BLOCK",
                                                           "ROUTE-CREATOR",
                                                           "ROUTE-IMPLEMENTATION",
                                                           "NOT-APPLICABLE"
                                                       ]
                                          },
                       "execute_allowed":  {
                                               "type":  "boolean"
                                           },
                       "safe_to_execute":  {
                                               "type":  "string",
                                               "enum":  [
                                                            "NOT-RUN",
                                                            "NOT-APPLICABLE",
                                                            "PASS",
                                                            "WARN",
                                                            "FAIL",
                                                            "CRITICAL"
                                                        ]
                                           },
                       "audit_status":  {
                                            "type":  "string",
                                            "enum":  [
                                                         "NOT-APPLICABLE",
                                                         "PENDING",
                                                         "FINAL"
                                                     ]
                                        },
                       "final_decision":  {
                                              "type":  [
                                                           "string",
                                                           "null"
                                                       ],
                                              "enum":  [
                                                           null,
                                                           "APPROVED",
                                                           "ADAPT",
                                                           "REFERENCE-ONLY",
                                                           "REJECTED"
                                                       ]
                                          },
                       "evidence_required":  {
                                                 "type":  "boolean"
                                             },
                       "facts":  {
                                     "type":  "array",
                                     "items":  {
                                                   "type":  "string"
                                               }
                                 },
                       "inferences":  {
                                          "type":  "array",
                                          "items":  {
                                                        "type":  "string"
                                                    }
                                      },
                       "unknowns":  {
                                        "type":  "array",
                                        "items":  {
                                                      "type":  "string"
                                                  }
                                    },
                       "required_actions":  {
                                                "type":  "array",
                                                "items":  {
                                                              "type":  "string"
                                                          }
                                            },
                       "token_measurement":  {
                                                 "type":  "string",
                                                 "enum":  [
                                                              "actual",
                                                              "not-measured",
                                                              "not-applicable"
                                                          ]
                                             },
                       "actual_tokens":  {
                                             "type":  [
                                                          "integer",
                                                          "null"
                                                      ],
                                             "minimum":  0
                                         }
                   }
}